"anonym_id","duration..in.seconds.","finished","recordeddate","dismiss_1","research_stage","q22","q22_6_text","feeling_stage_1","feeling_stage_2","feeling_stage_3","feeling_stage_4","feeling_stage_5","feeling_stage_6","feeling_stage_7","feeling_stage_8","feeling_stage_9","feeling_stage_10","feeling_stage_11","feeling_stage_12","feeling_stage_13","feeling_stage_14","feeling_stage_15","feeling_stage_16","feeling_stage_17","feeling_stage_18","feeling_stage_19","feeling_stage_20","cause_stage","feeling_general_1","cause_general","category_of_work","position","area","gender","age","country","country_other"
331,"466",TRUE,"2025-12-15 16:52:48","Yes","Preparations (IRB permit, preregistration, experiment preparations)","","","5","1","3","4","4","2","0","0","2","0","1","0","0","0","1","2","1","0","0","1","The main cause of the most intense feeling (interest) is my involvement in the new aspects of the project, which I never did before, new experience, and working in a supportive team of professionals","2","I have an opportunity to follow my interests","Clinical research","Non-academic researcher","Health sciences","Woman","36","Germany",""
332,"268",TRUE,"2025-12-15 16:56:28","Yes","Data collection","","","5","2","3","0","0","3","0","0","2","0","0","0","0","0","0","0","0","0","0","0","I am interested to see what the data will show and how we can contribute to the literature in this area. ","0","The current funding landscape in the US and the increase in administrative duties I have encountered recently","Clinical research","Full professor","Health sciences","Woman","46","United States of America",""
333,"264",TRUE,"2025-12-15 17:03:36","Yes","Waiting for journal's response and revisions","","","","","","","","","","","","","","","","","","","","","","","","2","research is interesting, full of surprises and also satisfactory to understand things which i did not do so until earlier","Field research","Full professor","Health sciences","Man","72","United Kingdom of Great Britain and Northern Ireland",""
334,"198",TRUE,"2025-12-15 17:08:46","Yes","Data analysis","","","7","0","5","0","5","3","0","0","3","0","0","0","0","0","0","5","0","0","0","0","I was very interested in analyzing my results - I had to keep going back and forth to make sense of them with the statistician. ","-1","The pressure to be productive AND achieve grant funding is debilitating. ","Clinical research","Assistant professor","Health sciences","Woman","39","United States of America",""
335,"254",TRUE,"2025-12-15 17:10:03","Yes","Revisions","","","2","2","4","2","1","4","2","2","1","1","2","1","1","1","1","3","2","1","1","1","Revisions are generally tedious, but don't provoke much emotion ","1","Satisfaction ","Lab/online research","PhD student","Physical sciences","Man","25","United Kingdom of Great Britain and Northern Ireland",""
336,"269",TRUE,"2025-12-15 17:17:37","Yes","Report writing","","","6","4","7","5","5","6","2","5","7","5","1","0","0","0","3","0","0","0","0","0","Relief and pride were the most intense feelings.  Finishing a 3 year study and now being in the manuscript draft phase feels like a huge accomplishment not only because the project is complete but because I feel like our team used our grant dollars well and invested time and resource into important work that is now close to dissemination.","2","I enjoy the work and feel accomplished and valued in this work.  I am proud of the work I am doing.","Clinical research","Associate professor","Health sciences","Woman","51","United States of America",""
337,"373",TRUE,"2025-12-15 17:20:24","Yes","Report writing","","","6","6","6","2","2","2","0","0","2","3","0","3","3","0","0","0","0","1","0","0","High pressure of having to pull 2 years of work into a single report, going back and forth at feeling pride in everything we accomplished but also guilt that we didn't get everything done or that funder may be disappointed.  Feeling proud of my team and their committment to the mission of the project, but then also frustrated that we have to frame it in a way that will be ""sellable"" to our funders and policy makers as opposed to being able to critically honest in in-your-face with our findings.  ","1","I am honored to have a career that I sought and I do enjoy research.  I am way overworked though and funding has become so politicized.  ","Lab/online research","Other","Social sciences","Woman","47","United States of America",""
338,"543",TRUE,"2025-12-15 17:31:48","Yes","Data collection","","","6","0","6","4","4","6","7","4","1","7","5","0","0","0","1","1","1","5","1","1","Love - the interviews i conduct provide a gateway into humanbeings inner souls and that fills me with love","2","Meaningfullness and control over time/workplanning","Field research","Postdoc","Social sciences","Woman","54","Sweden",""
339,"304",TRUE,"2025-12-15 17:34:19","Yes","Data analysis","","","5","5","0","0","0","0","0","0","0","0","0","0","0","0","5","0","3","0","0","3","frustration. research coordinator's inability to get to a clean, analysis ready dataset","1","scientific interest","Clinical research","Full professor","Health sciences","Prefer not to say","50","United States of America",""
340,"311",TRUE,"2025-12-15 17:49:47","Yes","Data collection","","","5","3","4","0","4","2","0","3","3","2","2","0","2","0","2","2","0","0","0","2","Most intense feeling is 'interest', caused by intrinsic interest in the topic I am studying. ","1","I generally enjoy the day-to-day tasks of a researcher and I am proud to be doing what I'm doing. But it's not light work.","Lab/online research","PhD student","Social sciences","Woman","23","Netherlands",""
341,"114",TRUE,"2025-12-15 17:52:09","Yes","Project genesis/ first thoughts/ idea creation","","","6","3","3","3","3","2","2","4","5","5","0","0","0","0","0","0","0","0","0","0","","0","","Lab/online research","Full professor","Life sciences","Man","51","United States of America",""
342,"191",TRUE,"2025-12-15 17:53:36","Yes","Report writing","","","3","1","5","3","2","4","0","0","6","0","0","5","6","0","2","1","0","0","0","0","project took way too long, and was too much work compared to the available funding","3","autonomy, curiosity, social interaction","Clinical research","Full professor","Health sciences","Man","45","Austria",""
343,"1314",TRUE,"2025-12-15 18:03:42","Yes","Reality check (e.g., literature search, consultation with colleagues)","","","7","0","7","7","7","7","7","7","7","3","2","2","0","0","0","7","0","0","0","6","The project was new and after a long time of being bored this is exciting!","1","I dont have time to do my oun research which is the best part of research...","Lab/online research","Associate professor","Health sciences","Woman","49","Israel",""
344,"412",TRUE,"2025-12-15 18:05:44","Yes","Data collection","","","7","7","5","7","6","7","4","4","5","2","0","0","0","0","0","2","0","0","0","0","I am very interested in my research and at the same time it resembles a game that amuses me.","2","I choose my project and my strategy every day, every week, every month","Lab/online research","Full professor","Life sciences","Man","61","France",""
345,"426",TRUE,"2025-12-15 18:06:09","Yes","Revisions","","","7","2","1","1","1","5","0","0","1","0","7","0","5","0","5","0","0","6","4","4","Science is complicated. Working with human samples and human stem cell models pushes the complexity to a new level of complexity. The complexity, the instability of funding, presure by supervisor to obtain data fast, and the time constraint by the journal make a difficult process even more frustrating, demoralizing, and physically and emotionally exhausting.   ","-1","Pressure to publish, lack of clear career path in academia, not enough monetary compensation for the skill labor we provide.","Lab/online research","Postdoc","Health sciences","Man","32","United States of America",""
346,"165",TRUE,"2025-12-15 18:07:24","Yes","Reality check (e.g., literature search, consultation with colleagues)","","","5","0","3","0","2","2","0","0","0","0","3","1","3","0","0","0","2","0","0","0","research is a lot of work","1","i'm not sure","Clinical research","Full professor","Health sciences","Woman","52","United States of America",""
347,"273",TRUE,"2025-12-15 18:09:06","Yes","Revisions","","","7","6","7","6","6","5","5","5","5","5","4","4","0","1","4","1","0","0","0","0","The feeling that research is never perfect and always has room for improvement.","1","A little proud of both the quantity and the quality.","Field research","Other","Health sciences","Woman","33","Brazil",""
348,"1457",TRUE,"2025-12-15 18:09:31","Yes","Data collection","","","5","2","4","3","3","2","1","0","0","2","0","0","0","0","0","0","0","0","0","0","Both, interest and pride are due to the long time spent in my line of research, to the novelty of the my current project","1","I think I could have published much more","Lab/online research","Full professor","Social sciences","Woman","60","Spain",""
349,"502",TRUE,"2025-12-15 18:09:59","Yes","Project genesis/ first thoughts/ idea creation","","","6","6","5","5","5","4","5","3","3","1","0","0","0","0","0","1","0","0","0","0","","1","","Lab/online research","Associate professor","Life sciences","Man","49","Italy",""
350,"2402",TRUE,"2025-12-15 18:10:48","Yes","Post-project stage (the project has received a decision (accepted or rejected). At this point, it is either concluded or being revised and prepared for submission to another venue)","Rejected and being revised","","4","4","3","2","1","1","1","1","1","0","5","0","1","0","5","2","3","3","3","4","The most intense emotions I face as a scientist are disappointment and sadness, primarily stemming from the constant rejection of my work by journals and funding agencies. It requires tremendous resilience to persevere in this field, especially when you are from a peripheral country with severe underfunding.","-1","The constant expectation of failure.","Lab/online research","Associate professor","Life sciences","Man","47","Brazil",""
351,"213",TRUE,"2025-12-15 18:16:32","Yes","Data analysis","","","5","0","0","0","0","0","0","0","0","0","0","3","0","0","0","0","0","0","0","0","Interest in getting the results and hopeful that something interesting will be found. Guilty about lack of productivity or how long things are taking. ","-1","Current USA research climate is very grim and not encouraging. Funding sources are extremely limited. I worry about my financial ability to maintain this career. ","Clinical research","Postdoc","Health sciences","Man","39","United States of America",""
352,"319",TRUE,"2025-12-15 18:23:29","Yes","Report writing","","","3","2","3","2","2","3","2","3","3","2","0","0","0","0","0","0","0","0","0","0","Finally putting together the work of months","2","experiencing the impact and science behind my everyday practice","Clinical research","Full professor","Health sciences","Man","59","Belgium",""
353,"180",TRUE,"2025-12-15 18:39:59","Yes","Data analysis","","","7","2","5","4","5","2","0","4","4","0","1","0","3","0","4","3","0","0","0","0","Interest - because I am very interested in my research topic ","2","Interested in the topics and like working with my colleagues","Lab/online research","Postdoc","Life sciences","Woman","35","United States of America",""
354,"537",TRUE,"2025-12-15 18:43:07","Yes","Data analysis","","","6","5","2","4","4","3","3","4","3","3","3","2","3","3","6","3","1","1","2","2","my feeling of interest is linked to the curiosity to the subject ","2","Not being forced to work for profit, exploring a topiv because it is interesting rather then profitable","Lab/online research","Postdoc","Health sciences","Man","35","United States of America",""
355,"301",TRUE,"2025-12-15 19:26:37","Yes","Post-project stage (the project has received a decision (accepted or rejected). At this point, it is either concluded or being revised and prepared for submission to another venue)","Accepted and published","","7","6","6","6","7","6","6","6","6","4","4","0","4","0","4","4","4","4","0","2","Interest. Wondering what will start next, the impact it will have, the reactions of other scientists, the generated knowledge,...","2","It is hard sometimes but the purpuse deserves it.","Field research","Associate professor","Health sciences","Woman","41","Spain",""
356,"262",TRUE,"2025-12-15 19:28:38","Yes","Report writing","","","6","5","6","6","6","6","0","3","1","0","3","3","4","3","3","2","0","1","1","2","fear that the study is not complete","1","rewards were not enough","Clinical research","Non-academic researcher","Health sciences","Man","51","Italy",""
357,"479",TRUE,"2025-12-15 19:55:13","Yes","Data collection","","","7","5","4","7","7","4","0","1","0","7","0","0","0","0","0","1","0","0","0","0","Excited and happy about an ongoing research project","3","The fact that my job is my hobby","Lab/online research","Full professor","Life sciences","Man","61","Germany",""
358,"234",TRUE,"2025-12-15 20:00:03","Yes","Report writing","","","6","4","6","6","6","6","4","6","7","6","1","1","1","1","1","1","1","1","1","1","interest in research","3","good outcomes","Clinical research","Full professor","Health sciences","Man","79","United Kingdom of Great Britain and Northern Ireland",""
359,"622",TRUE,"2025-12-15 20:10:07","Yes","Waiting for journal's response and revisions","","","0","0","4","4","7","7","0","0","7","0","0","0","0","0","0","7","0","0","0","0","Fear the it will not be accepted for publication","2","Being able to answer clinical questions based upon research","Clinical research","Full professor","Health sciences","Man","89","United States of America","Remelem hogy segitettem a kutatasban"
360,"344",TRUE,"2025-12-15 21:05:38","Yes","Post-project stage (the project has received a decision (accepted or rejected). At this point, it is either concluded or being revised and prepared for submission to another venue)","Rejected and postponed","","7","1","7","1","1","0","0","0","1","7","7","1","3","3","7","1","0","0","0","0","Research was stonewalled due to supervision not being suitable and academic gatekeeping.  Unable to find a member of relevant profession to work with me","-3","I took on the role of highlighting errors in current systemic approaches - this was not welcomed","Clinical research","Other","Health sciences","Woman","53","Ireland",""
361,"154",TRUE,"2025-12-15 21:13:04","Yes","Report writing","","","6","3","7","6","6","6","5","5","5","0","0","0","0","0","0","0","0","0","0","0","I love what I do.","3","I love what I do.","Lab/online research","Full professor","Social sciences","Man","75","United States of America",""
362,"264",TRUE,"2025-12-15 22:36:29","Yes","Data analysis","","","7","4","5","5","6","5","0","4","4","2","0","0","0","0","0","0","0","0","0","0","I enjoy research ","2","I enjoy research, but didnt rate it as 3+ due to the challenges associated with conducting research at my institution ","Lab/online research","Associate professor","Health sciences","Man","61","Australia",""
363,"373",TRUE,"2025-12-15 22:50:02","Yes","Report writing","","","6","6","6","6","5","6","3","5","5","5","1","1","1","1","1","1","1","1","1","1","Interest","3","Get my targets","Field research","Full professor","Social sciences","Man","54","Spain",""
364,"160",TRUE,"2025-12-15 22:53:31","Yes","Data collection","","","0","0","4","1","2","1","0","0","5","3","2","0","0","0","2","2","0","0","0","0","pressure to get participants for sample size","0","difficulties>success","Clinical research","Assistant professor","Health sciences","Woman","45","Australia",""
365,"648596",TRUE,"2025-12-15 22:58:55","Yes","Post-project stage (the project has received a decision (accepted or rejected). At this point, it is either concluded or being revised and prepared for submission to another venue)","Accepted and published","","6","0","7","6","6","7","0","0","7","0","3","2","0","0","0","0","0","0","0","0","So much hard work and mental effort - then post publication, the article was picked by influential people on X and had the effect I wanted - relevant researchers planning a clinical trial are interested in incorporating the findings into a platform trial. ","-1","So much frustration around the administrative part of it. So much work on cutting word count in mansuscripts and formatting things, why?","Lab/online research","Non-academic researcher","Health sciences","Woman","46","Australia",""
366,"180",TRUE,"2025-12-15 23:43:50","Yes","Waiting for journal's response and revisions","","","3","2","4","3","4","5","2","3","3","2","1","1","1","1","1","2","1","2","1","1","Happy with how the project turned out, annoyed at the journal submission process, length, requirements. ","3","I work with great people and have good work life balance","Field research","Postdoc","Health sciences","Woman","35","Australia",""
367,"308",TRUE,"2025-12-15 23:49:27","Yes","Report writing","","","5","1","3","3","4","4","1","1","3","2","3","2","3","1","1","2","0","0","0","0","this is both too simplistic and abstract - I have may projects with many different phases, at the same time other challengers at work ( teaching, committees ect) plus a life outside work. I can't compartmentalize my feelings to specific project stages this way and I am not sure I cna give meaningful answers in your check boxes","2","","Lab/online research","Associate professor","Life sciences","Woman","43","Denmark",""
368,"241",TRUE,"2025-12-16 00:21:16","Yes","Revisions","","","3","3","3","4","4","3","3","2","4","2","4","0","4","0","5","0","2","1","1","1","","-1","","Lab/online research","Full professor","Health sciences","Man","43","China",""
369,"328",TRUE,"2025-12-16 00:23:09","Yes","Waiting for journal's response and revisions","","","6","4","5","5","5","6","4","5","5","7","0","0","0","0","2","0","1","0","0","0","Doing something for future benefit of the generations","3","I love research","Clinical research","Assistant professor","Health sciences","Woman","34","India",""
370,"79",TRUE,"2025-12-16 00:32:56","Yes","Data collection","","","5","6","6","5","4","4","6","6","5","6","4","5","4","4","5","3","4","4","5","4","","-2","clinical dutoes are overwhelming ","Clinical research","Associate professor","Health sciences","Man","50","Italy",""
371,"437",TRUE,"2025-12-16 00:46:13","Yes","Post-project stage (the project has received a decision (accepted or rejected). At this point, it is either concluded or being revised and prepared for submission to another venue)","Accepted and published","","6","4","7","6","5","6","4","3","7","0","3","0","1","0","0","0","0","0","0","0","I picked those feelings because after many years, the project was finally done, and all the hard work paid off, and I could start new projects. ","1","I think it's a positive thing because you learn a lot and meet very interesting people. But it's a very demanding life and sometimes it consumes you.  ","Field research","Postdoc","Health sciences","Woman","31","Spain",""
372,"1184",TRUE,"2025-12-16 00:46:36","Yes","Report writing","","","6","0","6","5","4","6","0","7","0","0","0","0","5","0","4","5","5","0","0","5","I have deep admiration for my mentor.","2","I believe our research suits me well, and I truly enjoy working on it.","Lab/online research","Research assistant","Life sciences","Woman","50","Japan",""
373,"249",TRUE,"2025-12-16 00:52:19","Yes","Revisions","","","6","0","4","2","2","2","0","0","1","0","0","0","0","0","3","0","0","0","0","0","Third revision of a ms required","3","Success, influencing the field, improving lives of affected persons","Clinical research","Full professor","Health sciences","Man","78","Australia",""
374,"510",TRUE,"2025-12-16 01:27:27","Yes","Data collection","","","6","2","6","4","0","4","0","0","0","5","0","4","1","0","4","0","0","0","0","0","pride in study and team behind it","2","overall positive but also stressful","Clinical research","Full professor","Health sciences","Woman","53","Canada",""
375,"276",TRUE,"2025-12-16 01:27:40","Yes","Post-project stage (the project has received a decision (accepted or rejected). At this point, it is either concluded or being revised and prepared for submission to another venue)","Other (Please specify):","It is an ongoing project. One publication from it came out in November, followed by a conference. We are now trying to decide whether to write another article about it and other ways to move forward. ","5","4","5","5","5","5","1","1","6","0","0","0","1","0","0","0","0","0","0","0","I was happy and relieved that the conference went well and interested in the problem, intellectual and practical, about how to move forward. ","3","I like thinking about, and writing about, new ideas. ","","Full professor","Social sciences","Man","73","United States of America",""
376,"1197",TRUE,"2025-12-16 02:06:13","Yes","Waiting for journal's response and revisions","","","5","1","4","3","3","4","1","1","0","0","0","0","0","0","3","0","1","0","0","1","It is disappointing when my submissions get rejected","2","Discoveries or achievements following repeated failures in the study","Lab/online research","Full professor","Health sciences","Woman","42","China",""
377,"316",TRUE,"2025-12-16 03:15:26","Yes","Data collection","","","4","4","0","0","0","0","0","0","0","0","2","0","0","0","3","1","0","0","1","2","do not get positive feedback and reward","-1","","Lab/online research","PhD student","Life sciences","Woman","38","China",""
378,"189",TRUE,"2025-12-16 05:01:41","Yes","Waiting for journal's response and revisions","","","7","6","4","6","6","5","5","7","7","7","6","5","4","4","3","4","3","5","3","5","For Growth","2","Internal Happiness","Field research","Associate professor","Life sciences","Man","43","India",""
379,"333",TRUE,"2025-12-16 07:01:38","Yes","Reality check (e.g., literature search, consultation with colleagues)","","","7","0","5","7","7","7","7","7","7","7","5","0","0","0","3","0","0","0","0","3","The fact that I found out a very relevant and substantial field of work which will help elevate the population-level health status and also enable me to move up up the ladder in my career, which is a double win.","2","I am able to do substantial, relevant work on my own without any guidance or (large scale) institutional support.","Lab/online research","Associate professor","Social sciences","Woman","39","India",""
380,"277",TRUE,"2025-12-16 08:12:05","Yes","Data analysis","","","5","4","5","5","5","3","4","5","3","4","3","5","5","4","3","2","2","3","2","2","I do feel some guilt and regret dringend this project as I promised to deliver the results earlier ","2","I feel I do important work","Clinical research","Postdoc","Physical sciences","Man","34","Netherlands",""
381,"337",TRUE,"2025-12-16 08:45:22","Yes","Project genesis/ first thoughts/ idea creation","","","7","0","7","7","7","7","0","3","3","1","0","0","0","0","0","0","0","0","0","1","it is a new project i am thinking with a very new mehod and I am super excited to try it on our data and see what the results will show.","0","i do it but it is no more my passion","Clinical research","Assistant professor","Health sciences","Woman","45","Sweden",""
382,"383",TRUE,"2025-12-16 08:57:04","Yes","Revisions","","","2","1","1","1","1","1","1","1","1","1","1","1","1","1","1","0","1","1","0","0","upset","1","pressure","Field research","Associate professor","Social sciences","Woman","45","China",""
383,"1913",TRUE,"2025-12-16 08:57:16","Yes","Waiting for journal's response and revisions","","","7","6","7","7","7","7","5","6","5","0","0","2","2","0","2","2","0","0","0","0","When the manuscript came with comments for minor revision, I felt positive emotions. When I identified some errors in the manuscript, or the reviewer identified some errors, I felt negative emotions. I also thought about peer opinions and how they would view my manuscript once it is published.","2","I love doing research. But as an academician and clinician as added role, it is not possible to dedicate whole time on research.","Clinical research","Associate professor","Health sciences","Woman","39","India",""
384,"558",TRUE,"2025-12-16 09:03:13","Yes","Revisions","","","5","4","4","3","4","5","0","0","5","4","0","3","3","3","0","0","0","0","0","0","Interest, contentment, relief about the revision being almost complete and thereby this sub study is concluded. Pleased about the reviewers and editors comments that helped to elevate the paper. Happy about the end result and that the ability to share it publicly is now close.","1","In my country the Netherlands the terms of employment are good (salary, holiday days, holiday allowance, end of year allowance, etc). Talking to participants, teaching and presenting novel findings is exciting. ","Field research","PhD student","Social sciences","Woman","29","Netherlands",""
385,"977",TRUE,"2025-12-16 09:09:26","Yes","Waiting for journal's response and revisions","","","3","2","3","3","3","3","2","2","4","2","0","0","0","0","0","2","1","0","0","2","As for relief, it's contributed by the sense of feeling of finally finish this project.
","1","I think I'm not a talented researcher, but I learned a lot through doing research, especially the ability to cooperate with other researchers, the ability to lead a project, the ability to negotiate with different  people. Doing research allow me to learn the ability of close-loop, with not very harsh punishment compared to going to a company. Although the time here is long and sometimes tired, but I do acknowledge the time here to allow me growth under a kind supervisor.","Lab/online research","PhD student","Life sciences","Woman","26","China",""
386,"303",TRUE,"2025-12-16 09:54:27","Yes","Report writing","","","7","1","1","7","","1","1","1","1","4","1","1","5","1","1","1","1","1","1","1","","2","I very much enjoy it but in my opinion there are too many publications and hardly any time to catchup with them.","Lab/online research","Full professor","Social sciences","Woman","60","Netherlands",""
