"anonym_id","duration..in.seconds.","finished","recordeddate","dismiss_1","research_stage","q22","q22_6_text","feeling_stage_1","feeling_stage_2","feeling_stage_3","feeling_stage_4","feeling_stage_5","feeling_stage_6","feeling_stage_7","feeling_stage_8","feeling_stage_9","feeling_stage_10","feeling_stage_11","feeling_stage_12","feeling_stage_13","feeling_stage_14","feeling_stage_15","feeling_stage_16","feeling_stage_17","feeling_stage_18","feeling_stage_19","feeling_stage_20","cause_stage","feeling_general_1","cause_general","category_of_work","position","area","gender","age","country","country_other"
975,"2376",TRUE,"2026-02-11 16:48:19","Yes","Waiting for journal's response and revisions","","","2","0","0","2","0","4","0","0","4","0","0","0","0","0","0","4","0","0","0","2","Fear: While there is relief in having completed a major task, like submitting a manuscript for review, waiting for a response, and contemplating on what that response might be is stressful which contains elements of fear. Thinking about it now has my heart racing. ","2","I enjoy learning new things and solving problems. Having a job that allows me to do those things, is wonderful. Then there is the community in research. While there are bad experience, on a whole it too is wonderful. Almost like an extended family. ","Lab/online research","Assistant professor","Life sciences","Man","47","United States of America",""
976,"192",TRUE,"2026-02-11 16:49:03","Yes","Data collection","","","5","5","4","3","3","5","0","0","2","0","0","0","0","0","1","2","0","0","0","0","interest- i am doing this reeseach project primarily because i am extremely interested in the topic and would like to investigate it further","2","i love the work i am doing: it is stimulating and challenging in a good way","Lab/online research","Assistant professor","Social sciences","Woman","38","Netherlands",""
977,"409",TRUE,"2026-02-11 17:11:05","Yes","Data analysis","","","5","3","4","3","2","4","0","0","1","0","5","4","4","0","3","1","0","0","0","4","Not a specific common direction as a team. Too many Changes in the apporach and procedure.","0","I don’t feel i have recognition by the academic comunity, and it’s hard to work eventhough i have the qualifications and the experience","Lab/online research","Postdoc","Health sciences","Woman","34","Spain",""
978,"1232",TRUE,"2026-02-11 17:21:58","Yes","Data collection","","","7","6","7","7","4","0","0","0","0","0","0","0","0","0","4","0","0","0","0","2","Bureaucracy and paperwork being in the way of me doing the research I love. ","2","I love research, I just hate all the irrelevant paperwork that then goes to die on some administrator's hard drive never to be seen again, silly committees, and endless irrelevant meetings that just waste everyone's time.","Lab/online research","Full professor","Life sciences","Man","47","United States of America",""
979,"157",TRUE,"2026-02-11 17:49:01","Yes","Waiting for journal's response and revisions","","","7","3","7","7","7","7","4","5","6","7","1","1","1","1","1","1","1","1","1","1","5 year of work finally recognized with a high level publication","3","Always learning something new!","Lab/online research","Full professor","Health sciences","Man","67","Canada",""
980,"215",TRUE,"2026-02-11 17:52:19","Yes","Project genesis/ first thoughts/ idea creation","","","7","6","7","7","7","6","0","0","5","0","0","0","0","0","0","2","0","0","0","0","Dreaming about what is possible at the start of the proposal/grant writing","1","Impact","Clinical research","Associate professor","Health sciences","Man","43","United States of America",""
981,"188",TRUE,"2026-02-11 18:47:59","Yes","Data collection","","","5","4","6","5","4","3","4","5","4","2","4","5","5","5","5","4","2","1","1","5","Pride: ambitious project that is helping people, even in just the data collection process","2","As a PI, I have a very high level of autonomy to set my own research direction. I am also really lucky that I currently have a fellowship grant, which means I have a good amount of resources to conduct the project.","Lab/online research","Associate professor","Health sciences","Woman","38","United Kingdom of Great Britain and Northern Ireland",""
982,"477",TRUE,"2026-02-11 19:14:16","Yes","Report writing","","","6","0","7","0","6","7","4","5","3","3","0","0","0","0","0","0","0","0","0","0","great results of the project and supportive project team","2","I am satisfied with the work and colleagues","Field research","Non-academic researcher","Life sciences","Woman","60","Italy",""
983,"848",TRUE,"2026-02-11 19:27:41","Yes","Waiting for journal's response and revisions","","","4","5","7","7","7","6","6","6","6","6","2","2","2","2","2","1","1","1","1","1","Feeling: Anxiety
Cause: The main cause is the uncertainty of the outcome. After months of work, the project is now in the hands of editors and reviewers, and I have no control over the timeline or the decision. This lack of control, combined with the pressure to publish, makes waiting emotionally difficult.","2","The main cause is intellectual freedom. I get to ask questions that matter to me, explore unknowns, and contribute something new to the world. Even when the process is hard, the opportunity to learn and discover keeps me deeply engaged and satisfied.","Field research","Associate professor","Health sciences","Man","49","Israel","Actually Im from Palestine unfortunatley there is no mention for state of Palestine"
984,"470",TRUE,"2026-02-11 20:02:39","Yes","Report writing","","","6","0","0","0","4","4","0","0","2","0","0","0","0","0","0","0","0","0","0","0","I have no idea what causes me to be interested in the things i'm interested in. I do things that I'm interested in because they are interesting, somewhat pleasurable, and I have a sense that they may be of some interest to others and serve some meaningful purpose at some point in time.","2","I derive some sense of meaning from what I do.","Clinical research","Full professor","Social sciences","Man","77","United States of America",""
985,"368",TRUE,"2026-02-11 20:03:38","Yes","Project genesis/ first thoughts/ idea creation","","","7","7","1","7","7","7","0","0","0","3","1","1","1","0","1","1","0","0","0","1","Interest and novelty of the topic AND the nice and smooth collaboration and understanding with others involved.","2","Being capable of working on interesting research questions with clinical relevance.","Clinical research","Full professor","Health sciences","Man","57","Belgium",""
986,"357",TRUE,"2026-02-11 20:21:34","Yes","Waiting for journal's response and revisions","","","5","1","3","3","1","3","1","2","2","5","1","0","0","0","4","0","0","0","0","0","Little acknowledgement for consideable achievements","2","Contributing to mankind's knowledge while helping patients","Clinical research","Full professor","Health sciences","Woman","55","Germany",""
987,"637",TRUE,"2026-02-11 20:25:03","Yes","Report writing","","","6","2","4","4","5","4","3","5","6","0","2","5","4","2","4","4","0","0","0","1","Manuscript writing brings a lot of relief, as it is a bit of a culmination of a project and that work can be checked off of the list. It also renews my interest in the work, as going through the process of justifying a study and writing up findings helps me feel excited again about what is going on the field and what we might be contributing to the literature. ","1","My time/focus/energy is pulled in many different directions, and so it is often difficult to make consistent progress on projects. I enjoy it when I am able to have the time to focus on my research, but it is stressful that research often has to be put on hold for other responsibilities. ","Lab/online research","Associate professor","Social sciences","Woman","42","United States of America",""
988,"297",TRUE,"2026-02-11 20:50:25","Yes","Waiting for journal's response and revisions","","","5","5","5","4","3","3","4","4","5","4","3","2","2","2","1","1","1","1","1","1","","2","notable achievements","Clinical research","Associate professor","Health sciences","Man","60","Spain",""
989,"473",TRUE,"2026-02-11 21:57:57","Yes","Data analysis","","","7","4","6","3","3","5","2","3","2","3","2","4","5","2","5","5","3","5","2","4","Interest/pride/joy in completing work that I think is very novel and will be well received","2","Working on passions and interests","Clinical research","Assistant professor","Health sciences","Man","32","Australia",""
990,"268",TRUE,"2026-02-11 22:02:18","Yes","Post-project stage (the project has received a decision (accepted or rejected). At this point, it is either concluded or being revised and prepared for submission to another venue)","Rejected and being revised","","6","5","6","5","5","6","5","5","6","4","6","6","3","4","7","5","6","4","0","4","Revisors are not fair enough to me and they seem to be focused on their own point of view rather than making a good evaluation of the project","2","International renown","Clinical research","Postdoc","Life sciences","Man","34","Spain",""
991,"245",TRUE,"2026-02-11 23:11:18","Yes","Report writing","","","7","7","7","7","7","6","5","5","5","4","0","0","0","0","0","1","0","0","0","0","Own research is an essential part of our clinical practice and benefits patients.","3","I see the utility of this.","Clinical research","Full professor","Health sciences","Man","60","Spain",""
992,"265",TRUE,"2026-02-12 00:07:34","Yes","Report writing","","","5","5","5","5","5","0","0","0","0","0","0","0","0","0","0","0","0","0","0","0","Being creative","3","Flexibility and being in control of what I do","Lab/online research","Assistant professor","Life sciences","Man","42","United States of America",""
993,"248",TRUE,"2026-02-12 02:05:00","Yes","Data analysis","","","7","7","5","5","6","6","6","6","2","6","1","0","2","0","1","0","0","0","0","0","My data analysis is pretty complicated. So every time I learn how to untangle something, makes me feel awesome! I can overcome obstacles all by myself!","2","I'm good at it!","Clinical research","PhD student","Health sciences","Woman","33","Australia",""
994,"198",TRUE,"2026-02-12 02:56:56","Yes","Data analysis","","","7","7","7","7","7","7","7","7","7","7","0","0","0","0","0","0","0","0","0","0","Interesting research question","3","I love to think","Clinical research","Associate professor","Life sciences","Man","53","Thailand",""
995,"454",TRUE,"2026-02-12 03:11:22","Yes","Waiting for journal's response and revisions","","","5","0","3","3","3","3","0","0","4","0","0","3","3","3","1","0","0","0","0","0","I was very relieved that the project was nearing a sound conclusion.","1","The possibility of making a significant contribution","Clinical research","Full professor","Health sciences","Man","77","Australia",""
996,"499",TRUE,"2026-02-12 07:09:29","Yes","Data analysis","","","5","1","5","3","4","4","0","0","4","5","0","5","0","0","0","0","0","0","0","0","To do a very interesting work ","1","Because in my work I don’t do only research but I have to do a lot of other work ","Field research","Full professor","Health sciences","Woman","57","Switzerland",""
997,"156",TRUE,"2026-02-12 08:05:02","Yes","Revisions","","","4","2","5","4","5","5","3","0","5","2","2","2","2","2","1","1","1","1","1","1","","2","High level of autonomy ","Clinical research","Postdoc","Health sciences","Man","35","Belgium",""
998,"212",TRUE,"2026-02-12 08:07:53","Yes","Waiting for journal's response and revisions","","","6","2","3","2","2","2","1","2","1","1","2","2","3","2","3","2","2","2","1","3","Perceived unfairness of the journal review process.","2","Can be very rewarding to discover new findings.","Lab/online research","Full professor","Social sciences","Man","58","United States of America",""
999,"603",TRUE,"2026-02-12 08:15:59","Yes","Waiting for journal's response and revisions","","","7","6","6","4","4","5","6","6","7","6","5","5","5","3","2","7","1","6","2","3","Is challenging to be a female clinician scientist, also coming from a MIC","2","I've had the opportunity of doing ground breaking work and collaborate with experts throughout the world","Clinical research","Assistant professor","Health sciences","Woman","39","Costa Rica","Canada"
1000,"492",TRUE,"2026-02-12 08:18:47","Yes","Data analysis","","","6","5","5","3","2","4","0","0","6","2","3","6","6","5","3","6","0","0","0","2","There is a fear at this point of data generation projects that everything will be wrong and flawed. As I work in collaborative environment it gets mixed with fear if disappointing and failing others","2","The excitement of starting something new, the joy of training others","Lab/online research","Assistant professor","Life sciences","Woman","40","Argentina",""
1001,"393",TRUE,"2026-02-12 08:19:20","Yes","Waiting for journal's response and revisions","","","2","0","0","0","0","0","0","0","1","0","1","0","1","0","1","1","1","0","1","0","1. My manuscript has been submitted over one year without a final decision. 2. I find my research direction is not well motivated and make no sense.","-1","Research topic is meaningless and no positive feedback now","Field research","PhD student","Physical sciences","Man","26","China",""
1002,"238",TRUE,"2026-02-12 08:19:29","Yes","Project genesis/ first thoughts/ idea creation","","","7","6","5","5","6","6","4","5","5","3","1","0","2","0","2","0","0","0","0","0","兴趣是科研的最重要原因","3","做研究是很快乐的事","Clinical research","Associate professor","Health sciences","Woman","41","China",""
1003,"421",TRUE,"2026-02-12 08:22:16","Yes","Data analysis","","","5","0","4","3","2","5","0","3","2","1","0","0","0","0","1","0","0","0","0","0","Contentment - The project is an excellent one and the results will help guide future interventions to reduce the incidence of neurodevelopmental disorders.","2","satisfaction with the opportunity to help others as a scientist.","Clinical research","Full professor","Health sciences","Man","77","United States of America",""
1004,"266",TRUE,"2026-02-12 08:27:38","Yes","Report writing","","","4","3","5","4","3","5","1","6","3","6","2","1","1","1","1","5","1","3","1","3","","2","","Lab/online research","Full professor","Life sciences","Man","46","Switzerland",""
1005,"1208",TRUE,"2026-02-12 08:30:30","Yes","Data collection","","","4","4","4","4","4","4","4","4","6","1","0","0","0","0","3","1","0","0","0","3","Having designed the research and reached the data collection stage, seeing that the data has been collected makes me feel very relieved. Therefore, relief.","3","Conducting research is often expensive (we usually cover the costs from our personal budgets). If this were a job, my primary motivation would be earning money. Therefore, spending a significant portion of my earnings on my ""work"" would bother me greatly. Additionally, it requires endless mental and physical effort, and there are no set working hours.   There isn't a single day when I don't work on my scientific research on my computer. Weekends, after work, holidays... I love being a researcher and accept all of this as part of the job. I feel like I'm breathing every second I spend researching and working on it. It's exhausting, both physically and mentally, but the happiness and satisfaction I feel when I upload an article to a journal is a real dopamine boost.  ","Field research","Assistant professor","Health sciences","Woman","30","Turkey",""
1006,"327",TRUE,"2026-02-12 08:34:02","Yes","Data collection","","","6","6","7","3","3","5","1","6","6","0","1","0","0","0","2","0","0","0","0","1","I'm proud and happy we were able to start collecting data after a long time dealing with legal and bureaucratic issues ","2","I'm happy with the research I have conducted but I think I could do more ","Lab/online research","Full professor","Health sciences","Man","60","Austria",""
1007,"219",TRUE,"2026-02-12 08:38:24","Yes","Report writing","","","7","6","5","5","6","0","0","4","4","0","2","2","0","0","0","0","0","0","0","0","","3","","Clinical research","Postdoc","Health sciences","Woman","42","Denmark",""
1008,"1027",TRUE,"2026-02-12 08:41:01","Yes","Waiting for journal's response and revisions","","","6","0","6","6","5","5","0","0","6","5","0","0","0","0","0","2","0","0","0","0","very (very intensive)major revision by the team, long waiting, big relief and pride receiving a minor revision vote in a top journal","3","great interest in subject, joy of better understanding and inventions , great team work, joint successes","Lab/online research","Full professor","Life sciences","Man","65","Germany",""
1009,"1720",TRUE,"2026-02-12 08:46:35","Yes","Post-project stage (the project has received a decision (accepted or rejected). At this point, it is either concluded or being revised and prepared for submission to another venue)","Accepted and published","","5","3","6","6","2","7","0","2","6","0","1","0","0","2","1","4","4","0","0","0","My sense of contentment stemmed from the satisfaction I derived from the work I completed. most of the project, I did not receive sufficient support from my mentor.","2","I feel this way because research is a professional activity that I genuinely enjoy as part of my work.","Clinical research","PhD student","Health sciences","Woman","37","Spain",""
1010,"188",TRUE,"2026-02-12 08:47:13","Yes","Data collection","","","6","3","3","3","2","4","1","1","2","1","6","6","5","6","6","6","0","3","2","2","Being not supported","2","I like challenges and my job","Clinical research","Postdoc","Health sciences","Man","42","Germany",""
1011,"836",TRUE,"2026-02-12 08:48:10","Yes","Post-project stage (the project has received a decision (accepted or rejected). At this point, it is either concluded or being revised and prepared for submission to another venue)","Accepted but not yet published","","5","0","5","3","0","3","0","1","6","0","0","0","0","0","0","0","0","0","0","0","I felt relief because the project so to speak 'grew legs' and took a lot longer to execute than anticipated. In such cases, it is a relief to get rid of the project which sometimes overshadow the positive emotions such as pride.  ","2","I am involved in projects that make a difference in clinical practice and follow my interest and curiosity. Very importantly, I get to see others grow. This is a source of immense joy for me. I'd say it is a highly motivating factor  for working in research. For example, when a colleague or a student achieves something (gets a grant, gets published etc.) ","Clinical research","Associate professor","Health sciences","Man","55","Denmark",""
1012,"176",TRUE,"2026-02-12 08:56:29","Yes","Preparations (IRB permit, preregistration, experiment preparations)","","","6","6","6","6","6","7","5","3","4","7","1","1","1","1","1","1","1","1","1","1","","2","","Clinical research","Associate professor","Health sciences","Man","39","Iceland",""
1013,"374",TRUE,"2026-02-12 08:58:31","Yes","Data analysis","","","7","5","6","5","5","5","0","0","0","0","0","0","3","0","1","0","0","0","0","0","Interest: I was curious to see the first results","2","Doing something meaningful and new that nobody else investigates and finding it intellectually satisfying every day","Field research","Full professor","Health sciences","Woman","37","Hungary",""
1014,"640",TRUE,"2026-02-12 09:02:33","Yes","Report writing","","","6","5","5","5","5","4","4","5","1","3","1","0","0","0","0","2","0","2","0","0","Admiration) I lead a large community driven initiative. I feel very greatful for and amazed by the people who contributed to my research. 
I think that's the reason for almost all of the positive feelings I experience during this project.","2","I enjoy my job and the flexibility that comes with it. ","Lab/online research","PhD student","Life sciences","Woman","29","United Kingdom of Great Britain and Northern Ireland",""
1015,"275",TRUE,"2026-02-12 09:06:44","Yes","Revisions","","","6","1","0","0","0","0","0","2","0","0","0","0","0","0","1","0","0","0","0","0","Interest in learning what other colleagues do in my research fields.","2","Interest in linking research questions with methods.","Field research","Other","Health sciences","Man","60","Italy",""
1016,"644",TRUE,"2026-02-12 09:10:28","Yes","Post-project stage (the project has received a decision (accepted or rejected). At this point, it is either concluded or being revised and prepared for submission to another venue)","Accepted but not yet published","","7","5","7","7","7","7","0","0","7","7","0","0","0","0","1","0","0","0","0","0","Content; this was a work I wanted to accomplish for many years and we eventually did it; it was also important that this was a team work, I was happy that I was able to get the team together and get agreement in all major points (this was an international consensus agreement white paper with some controversies in the field). Happy was not listed above, but I would use this to exemplify and synthesise all the positive feelings combined.","3","II enjoy the explores mind and all negative feelings and drawbacks are faded when they have passed. The positive overweight the negative and I can see the drawbacks more than challenges than negative outcomes.","Clinical research","Full professor","Health sciences","Woman","55","Sweden",""
1017,"784",TRUE,"2026-02-12 09:16:44","Yes","Waiting for journal's response and revisions","","","7","6","6","5","5","4","4","4","5","5","0","0","0","0","0","0","0","0","0","0","","2","","Lab/online research","Full professor","Physical sciences","Man","57","Iraq",""
1018,"159",TRUE,"2026-02-12 09:16:48","Yes","Data collection","","","2","1","1","1","1","1","1","1","1","1","0","0","0","0","2","2","3","3","3","3","i am just depressed","0","monotonous routines","Field research","PhD student","Health sciences","Woman","28","Germany",""
1019,"673",TRUE,"2026-02-12 09:21:18","Yes","Revisions","","","7","3","4","6","5","3","1","2","2","2","0","0","0","0","1","1","0","0","0","0","Created more interest, joy and pride as the project was good and we can show impact and be successful.","3","interest and passion for research and make positive impact on science and people. ","Field research","Full professor","Life sciences","Man","55","United States of America",""
1020,"202",TRUE,"2026-02-12 09:25:33","Yes","Data analysis","","","7","7","7","7","7","0","0","0","0","0","4","0","0","0","4","0","0","0","0","0","","3","self-esteem","Clinical research","Associate professor","Health sciences","Man","45","France",""
1021,"201",TRUE,"2026-02-12 09:32:10","Yes","Post-project stage (the project has received a decision (accepted or rejected). At this point, it is either concluded or being revised and prepared for submission to another venue)","Accepted and published","","7","6","7","6","6","7","4","5","5","4","1","0","0","0","1","0","2","1","1","1","pride","2","I can orientate my research myself","Clinical research","Associate professor","Life sciences","Man","49","Belgium",""
1022,"110",TRUE,"2026-02-12 09:32:49","Yes","Data collection","","","2","1","1","1","1","1","1","1","1","1","1","1","1","1","3","2","2","0","1","1","","2","","Clinical research","Full professor","Health sciences","Man","44","France",""
1023,"193",TRUE,"2026-02-12 09:33:56","Yes","Post-project stage (the project has received a decision (accepted or rejected). At this point, it is either concluded or being revised and prepared for submission to another venue)","Accepted but not yet published","","7","2","7","7","0","7","0","0","7","2","1","1","1","1","1","1","1","1","0","0","","3","","Lab/online research","Full professor","Life sciences","Man","46","Denmark",""
1024,"263",TRUE,"2026-02-12 09:45:40","Yes","Preparations (IRB permit, preregistration, experiment preparations)","","","7","3","4","5","3","5","3","3","2","6","1","2","3","1","2","1","1","1","1","1","The research project is challenging on many levels, content, collaboration, but also really cool!","3","Nothing beats discovery!","Clinical research","Associate professor","Health sciences","Man","70","Switzerland",""
1025,"169",TRUE,"2026-02-12 09:52:55","Yes","Data collection","","","4","2","3","3","3","3","1","1","1","0","1","2","2","0","0","0","0","0","0","0","","1","Falta de tiempo para dedicarme en profundidad","Clinical research","Assistant professor","Health sciences","Woman","44","Spain",""
1026,"434",TRUE,"2026-02-12 10:01:58","Yes","Reality check (e.g., literature search, consultation with colleagues)","","","6","0","6","6","6","4","6","6","1","6","3","4","3","1","3","3","0","0","0","0","Pride in collaboration with co-researchers working under very under-resourced conditions to work on a project of professional worth provides sense of personal and professional value and contribution to the field. ","0","I have a lot of innovative ideas which excite me can't be executed due to time, organisational and financial constraints - so the positive and negative elements are in opposition. ","Clinical research","Non-academic researcher","Health sciences","Woman","53","South Africa","Africa"
1027,"263",TRUE,"2026-02-12 10:03:35","Yes","Report writing","","","0","5","4","2","3","0","0","0","0","0","0","0","0","0","0","0","0","0","0","0","it's always interesting to write a manuscript and discover connections that only appear when you write","3","I did what I wanted and I did it mostly as I wanted, with reasonable success","Lab/online research","Full professor","Life sciences","Man","68","Italy",""
1028,"302",TRUE,"2026-02-12 10:07:11","Yes","Revisions","","","7","7","5","7","7","7","7","7","5","7","1","1","1","1","1","1","1","7","1","1","","2","Curiosity for the novel innovation application in my research field","Field research","PhD student","Health sciences","Man","29","China",""
