"anonym_id","duration..in.seconds.","finished","recordeddate","dismiss_1","research_stage","q22","q22_6_text","feeling_stage_1","feeling_stage_2","feeling_stage_3","feeling_stage_4","feeling_stage_5","feeling_stage_6","feeling_stage_7","feeling_stage_8","feeling_stage_9","feeling_stage_10","feeling_stage_11","feeling_stage_12","feeling_stage_13","feeling_stage_14","feeling_stage_15","feeling_stage_16","feeling_stage_17","feeling_stage_18","feeling_stage_19","feeling_stage_20","cause_stage","feeling_general_1","cause_general","category_of_work","position","area","gender","age","country","country_other"
700,"248",TRUE,"2026-01-29 19:21:09","Yes","Post-project stage (the project has received a decision (accepted or rejected). At this point, it is either concluded or being revised and prepared for submission to another venue)","Accepted and published","","6","2","6","5","6","4","1","4","7","6","1","1","2","1","1","0","0","0","0","0","Project was very successful with a very strong and supportive collaborative group. ","3","I was fortunate to be very successful with projects that I and others consider to be important. ","Clinical research","Full professor","Health sciences","Man","70","United States of America",""
701,"947",TRUE,"2026-01-29 19:23:42","Yes","Data collection","","","7","0","0","3","5","3","0","0","0","0","0","5","2","2","7","1","0","0","0","7","I am very interested in generating data for this project, as it consists of a set of new techniques in our lab that I am optimizing. I am experiencing high intensity disappointment because the optimization of experimental conditions is complex and taking more time than anticipated. I am experiencing high intensity anger because my collaborators are not being clear about their goals and expectations regarding this project, and keep changing the experimental conditions, which in turn is causing me to take much longer than anticipated to optimize the experimental conditions. My collaborators are also not providing feedback when specifically asked by me and then I get blamed when the experiments are not optimized to their satisfaction.","0","Life as a researcher can be demoralizing. You work very hard sometimes and experiments still fail or you do not get expected results. However, when things do work and you make and exciting discovery, the feelings of accomplishment and pride offset the demoralization. So I rate it as neutral.","Lab/online research","Postdoc","Life sciences","Woman","44","Canada",""
702,"225",TRUE,"2026-01-29 19:28:57","Yes","Data analysis","","","6","2","4","2","2","3","1","3","5","2","3","3","3","1","4","2","1","1","1","1","relief we are done","3","accomplishments and accolades","Clinical research","Full professor","Health sciences","Man","70","United States of America",""
703,"721",TRUE,"2026-01-29 19:30:29","Yes","Data collection","","","7","7","4","4","3","2","7","7","2","7","5","6","6","4","7","7","4","5","3","7","Interest.. of my family and work area
Amusement.. I like to amuse myself self after hard work in research 
Love my family 
Admiration of my kids and wife
Disappointed by the work bad environment 
Fear of tomorrow
Anger because of Bureaucracy","-3","Hard work without good salary or even appreciation ","Field research","Associate professor","Physical sciences","Man","42","Egypt",""
704,"430",TRUE,"2026-01-29 19:40:59","Yes","Report writing","","","4","3","5","3","3","4","0","0","5","0","0","4","0","0","0","3","0","0","0","5","Relief that it was almost finished. Anger at issues that make it take longer than it should. Proud to be almost done","1","Enjoy the work, disappointed at the relatively low value placed on the process (all value is only assigned to results regardless of the difficulty of the methodology)","Clinical research","Associate professor","Health sciences","Man","46","United States of America",""
705,"658",TRUE,"2026-01-29 19:58:20","Yes","Project genesis/ first thoughts/ idea creation","","","7","","","","","","","","","","","","","","","6","6","","","","Afraid of not getting the project","2","I enjoy doing it","Lab/online research","Full professor","Life sciences","Woman","63","Spain",""
706,"234",TRUE,"2026-01-29 20:01:07","Yes","Reality check (e.g., literature search, consultation with colleagues)","","","6","5","4","5","6","4","1","4","1","1","1","3","1","1","3","2","1","1","1","1","I get very excited and interested in new research, but have a harder time getting excited about ideas that I have already explored more. ","-1","I don't feel like I have time to dedicate to good research, but I also work at a primarily teaching institution, so research is valued, but not necessarily well-supported","Field research","Associate professor","Health sciences","Woman","39","United States of America",""
707,"173",TRUE,"2026-01-29 20:07:29","Yes","Report writing","","","5","2","4","4","5","4","2","2","3","2","2","6","4","3","2","1","0","0","0","0","Report was overdue, hence guilt.","3","I love my research but feel hampered and depressed by my institutional context.","Lab/online research","Full professor","Social sciences","Man","67","United Kingdom of Great Britain and Northern Ireland",""
708,"493",TRUE,"2026-01-29 20:08:00","Yes","Waiting for journal's response and revisions","","","6","5","6","7","6","0","0","0","0","0","0","0","0","0","0","0","0","0","0","0","Joy","2","I can do what I love, and I have the opportunity for self-development","Lab/online research","Associate professor","Health sciences","Man","29","Hungary",""
709,"9888",TRUE,"2026-01-29 20:13:27","Yes","Project genesis/ first thoughts/ idea creation","","","7","6","7","7","7","7","7","7","7","7","1","0","0","0","0","0","0","0","0","0","I feel an inner excitement because I am working on a new topic that could be effective for psychological interventions.","3"," I love research. Because my work contributes to meaningful psychological interventions and helps populations affected by trauma, I feel a strong sense of purpose and internal motivation.","Clinical research","Associate professor","Health sciences","Man","49","United States of America",""
710,"231",TRUE,"2026-01-29 20:17:39","Yes","Report writing","","","6","4","5","5","4","2","0","0","0","0","0","0","0","0","0","0","0","0","0","0","","1","Used to be much higher - university appetite for funding is greater than ever even though it is clear that funding opportunities are declining.","Lab/online research","Associate professor","Life sciences","Man","53","United States of America",""
711,"440",TRUE,"2026-01-29 20:21:28","Yes","Reality check (e.g., literature search, consultation with colleagues)","","","6","2","5","2","2","4","1","0","7","4","5","0","4","0","5","3","0","0","3","3","Relief","-2","Pressure. Publication and grant race","Lab/online research","Full professor","Health sciences","Man","49","France",""
712,"328",TRUE,"2026-01-29 20:36:24","Yes","Project genesis/ first thoughts/ idea creation","","","3","","3","","","1","7","7","","4","1","","","2","","","","1","","2","","0","-","Field research","PhD student","Health sciences","Prefer not to say","26","Afghanistan",""
713,"679",TRUE,"2026-01-29 20:36:25","Yes","Report writing","","","7","0","6","6","6","5","0","0","0","0","2","1","1","1","1","1","1","1","1","1","The research results are supportive for our initial hypothesis.","3","I enjoy doing research in academia. I am excited every morning to think about ongoing research, plan next experiments, and how to resolve problems that I am facing during the course of research.","Lab/online research","Full professor","Life sciences","Man","70","United States of America",""
714,"253",TRUE,"2026-01-29 20:40:29","Yes","Data analysis","","","4","0","4","0","5","3","1","0","3","0","1","0","0","0","0","0","0","0","0","0","Mainly frustration but that's because I work full-time and it's hard to find time to work on my PhD research.","1","I enjoy thinking about and developing ideas and collaborating with others in the process.","Lab/online research","Other","Health sciences","Prefer not to say","41","United Kingdom of Great Britain and Northern Ireland",""
715,"907",TRUE,"2026-01-29 20:51:25","Yes","Project genesis/ first thoughts/ idea creation","","","7","6","6","5","6","5","5","7","5","2","1","1","1","2","2","4","1","3","1","1","The satisfaction of getting new results for the very first time. ","1","There is no a big support for research and development in my country. ","Lab/online research","Postdoc","Health sciences","Man","39","Spain",""
716,"454",TRUE,"2026-01-29 20:51:44","Yes","Post-project stage (the project has received a decision (accepted or rejected). At this point, it is either concluded or being revised and prepared for submission to another venue)","Accepted and published","","6","0","7","4","3","5","0","5","7","1","1","1","1","0","0","3","0","0","0","0","Pride was my highest score - I was 1st author on the paper and it took a lot of time to conduct and write the paper.","-1","I do not have enough time in my role for research.","Field research","PhD student","Health sciences","Woman","50","Australia",""
717,"751",TRUE,"2026-01-29 20:56:09","Yes","Data analysis","","","7","1","1","1","1","2","1","1","2","1","5","2","6","7","7","7","1","5","1","6","I am very disappointed, firstly in myself: compared to other researchers, I don't seem to have sparked enough interest among the participants in my research. The response rates to our questionnaire are very low. In relation to another research project (both equally important in my work), I am disappointed in my colleagues because I am not receiving the support they promised me. This makes me feel very left alone.","1","I previously worked as a nurse and find my current job less rewarding and satisfying. Nevertheless, I earn good money (albeit relatively little in relation to my long training and study period) and I can go home at the end of the day with less stress. Unfortunately, my working hours are relatively unlimited; I hope that this will improve after I obtain my PhD.","Field research","PhD student","Health sciences","Woman","38","Germany",""
718,"174",TRUE,"2026-01-29 21:12:57","Yes","Project genesis/ first thoughts/ idea creation","","","5","5","3","3","3","3","3","3","3","3","3","3","3","1","2","2","2","2","2","2","N/A","-1","No adequaate support - lack of funding","Clinical research","Assistant professor","Health sciences","Man","35","United States of America",""
719,"1428",TRUE,"2026-01-29 21:14:10","Yes","Reality check (e.g., literature search, consultation with colleagues)","","","7","6","0","6","5","0","0","3","0","0","0","6","2","0","3","3","0","0","0","1","Checking the literature and sharing with colleagues is always very enriching and energizing for me. I get to polish my idea and also some other ideas for the future, so I have felt an increasing level of interest since I started that phase.","1","It is great to do what you are passionate about, but there are lot of teaching (which is not bad) and bureacratic workloads that are quite annoying. Also there is a huge competition among colleagues and lots of job insecurity and future uncertainty that are not easy to manage. Also, at least in my region, there are not so many places where you can do research, so it complicate the life-work balance, especially if you have a partner outside academia or children","Lab/online research","Assistant professor","Social sciences","Man","42","Portugal",""
720,"498",TRUE,"2026-01-29 21:22:18","Yes","Data analysis","","","7","5","6","4","5","5","0","0","0","0","0","0","0","0","0","0","0","0","0","0","Interest, which is the main reason why I undertake research.","2","Love for new discoveries, possibility to do good to other people, intellectual stimuli and networking","Clinical research","Assistant professor","Health sciences","Woman","42","United Kingdom of Great Britain and Northern Ireland",""
721,"1078",TRUE,"2026-01-29 21:34:24","Yes","Report writing","","","6","1","4","6","6","3","1","1","1","2","1","2","1","0","0","2","0","0","0","0","I'm engaged in the work of synthesis of qualitative research and this process of creating a representative and clear written presentation of themes has the joy and interest that I experience in flow states in other domains as well. The joy is in effort as attention, or perhaps in the pleasure of the cognitive labor involved in the meaning-making aspects of writing.","1","Very little of my time is allotted for research, so fitting it in during the week requires enormous amounts of effort to balance it with other responsibilities.","Lab/online research","Associate professor","Social sciences","Woman","42","United States of America",""
722,"813",TRUE,"2026-01-29 21:36:15","Yes","Preparations (IRB permit, preregistration, experiment preparations)","","","6","5","4","4","4","4","4","3","5","4","1","1","1","0","1","3","0","0","0","0","The main feeling was interest, primarily caused by the novelty of the project and the fact that it involves a sample we have not previously studied. This new context sparked a high level of curiosity and motivation.","2","This feeling stems from how much I genuinely enjoy my work as a researcher. Although the core principles of research remain constant, the work is never truly the same. Over the years, I have progressively learned to conduct research more rigorously from a methodological perspective, and I find great satisfaction in applying and continuously refining this rigor. At the same time, I work on different topics, encounter new research questions, and engage with evolving study designs and statistical analyses, which keeps my work intellectually stimulating and deeply rewarding.","Lab/online research","Assistant professor","Health sciences","Woman","34","Spain",""
723,"538",TRUE,"2026-01-29 21:38:52","Yes","Data collection","","","7","6","7","6","6","5","0","3","7","0","7","0","0","0","7","7","3","6","4","7","Interest pride and relief, because I put a lot of effort into this project and it is great to see that we're getting fantastic results. Sadness, disappointment, fear and anger, because my job situation is uncertain and might lose my job within the next few months for reasons completely unrelated to my performance. ","3","I love what I do and my job gives me a lot of satisfaction and energy","Lab/online research","Associate professor","Life sciences","Woman","43","Mexico",""
724,"205",TRUE,"2026-01-29 21:39:10","Yes","Project genesis/ first thoughts/ idea creation","","","7","5","6","6","6","6","6","6","3","6","2","2","2","2","2","4","2","3","1","2","Excitement over the potential of the work, but frustration with funding.","2","the potential to help understand our conditions and possibly help","Clinical research","Full professor","Health sciences","Man","60","United States of America",""
725,"378",TRUE,"2026-01-29 21:54:05","Yes","Data analysis","","","3","0","0","0","0","0","0","0","0","0","0","0","0","0","2","0","0","0","0","0","The analysis phase I am in is monotonous and is taking longer than I would like, therefore there is disappointment that it is not going faster","1","I would enjoy it more if there was more understanding and support of my research from those higher up in my organization","Lab/online research","Associate professor","Health sciences","Woman","47","United States of America",""
726,"237",TRUE,"2026-01-29 22:09:54","Yes","Data collection","","","4","0","4","3","3","3","0","2","4","5","1","0","3","0","6","1","0","0","0","2","Frustration data collection is not going as well as we had hoped","2","Practice changing research","Field research","Full professor","Health sciences","Man","63","Canada",""
727,"177",TRUE,"2026-01-29 22:12:27","Yes","Waiting for journal's response and revisions","","","7","0","7","5","5","0","0","0","7","0","0","0","0","0","0","0","0","0","0","0","Relief and anticipation regarding finally submitting the paper and looking forward to peer review feedback, respectively.","3","I enjoy research and I think I'm pretty good at it.","Clinical research","Full professor","Social sciences","Man","68","United States of America",""
728,"225",TRUE,"2026-01-29 22:13:58","Yes","Data collection","","","5","4","6","6","6","3","5","4","3","6","0","0","0","0","0","0","0","0","0","0","Joy","2","Pride and compassion","Lab/online research","Full professor","Physical sciences","Man","57","United States of America",""
729,"221",TRUE,"2026-01-29 22:14:30","Yes","Revisions","","","6","3","7","4","4","4","4","0","0","0","0","0","0","0","0","0","0","2","0","0","I have a passion for my area of research and enjoy the work that I do. ","2","I feel successful as an early career, assistant professor at an R1 institution. I tend to keep my focus on the things I can control and work around funding constraints. ","Clinical research","Assistant professor","Social sciences","Man","30","United States of America",""
730,"606",TRUE,"2026-01-29 22:26:10","Yes","Revisions","","","7","3","7","4","3","7","0","0","7","0","7","0","0","0","7","0","0","2","2","7","The graduate student, who was supposed to be responsible for writing the manuscript, showed little participation/commitment, failing to demonstrate resilience and commitment to the project.","-1","Excessive institutional expectations and a lack of qualified personnel to execute projects at the expected level.","Lab/online research","Full professor","Health sciences","Man","50","Brazil",""
731,"248",TRUE,"2026-01-29 22:30:37","Yes","Reality check (e.g., literature search, consultation with colleagues)","","","5","4","4","4","4","2","2","3","0","2","3","3","3","3","0","0","0","0","0","0","Interest- the topic is interesting and I need to flesh out my thoughts more.","1","Proud of being a researcher working for a public institution, but it's a lot of work.","Clinical research","Assistant professor","Health sciences","Woman","38","United States of America",""
732,"355",TRUE,"2026-01-29 22:30:57","Yes","Report writing","","","6","0","6","4","5","6","0","2","2","0","0","2","0","0","0","2","0","0","0","0","Interest - I try to only do research on areas I am genuinely interested in. ","1","I love my work but am frustrated by funding conditions. ","Field research","Other","Social sciences","Woman","38","Australia",""
733,"176",TRUE,"2026-01-29 22:50:16","Yes","Data collection","","","5","3","5","5","4","4","3","3","1","3","0","0","0","0","0","0","0","0","0","0","The joy of developing something to really help my patient population","3","Freedom to chase after scientific unknowns","Lab/online research","Full professor","Life sciences","Man","71","United States of America",""
734,"271",TRUE,"2026-01-29 23:05:01","Yes","Revisions","","","6","2","4","6","6","5","0","5","4","2","1","1","1","1","3","1","1","1","1","1","As a senior academic with a substantial administrative part of my work, finding time for research, and engaging with it is very enjoyable, exciting, rewarding, and motivating.","2","Curiosity and interest to engage in informed discussions, the opportunity to learn - particularly in conversation/discussions with others.","Lab/online research","Full professor","Social sciences","Man","56","Australia",""
735,"254",TRUE,"2026-01-29 23:11:46","Yes","Waiting for journal's response and revisions","","","0","0","5","0","0","0","0","0","5","0","0","0","0","0","0","5","0","0","0","0","","2","Achievement ","Clinical research","Assistant professor","Health sciences","Woman","45","Singapore",""
736,"223",TRUE,"2026-01-29 23:56:56","Yes","Preparations (IRB permit, preregistration, experiment preparations)","","","4","2","4","3","2","3","2","3","2","3","5","2","2","2","2","2","2","2","2","4","","2","","Field research","Associate professor","Physical sciences","Woman","37","Japan",""
737,"517",TRUE,"2026-01-30 00:02:13","Yes","Post-project stage (the project has received a decision (accepted or rejected). At this point, it is either concluded or being revised and prepared for submission to another venue)","Accepted and published","","7","3","6","7","7","3","6","6","7","2","1","2","3","1","2","4","1","1","1","2","I always allow myself a little time to bask at the end of a big project that has many risks and many responsibilities to the young people I work with.","3","Excitement of the unexpected, thrill of the chase","Lab/online research","Full professor","Life sciences","Woman","84","Australia",""
738,"288",TRUE,"2026-01-30 00:37:57","Yes","Data collection","","","4","2","3","3","3","4","3","2","3","3","1","1","2","1","1","4","1","2","1","1","Grateful to have a steady project/employment/job","1","A good career for the most part","Lab/online research","Assistant professor","Health sciences","Woman","39","United States of America",""
739,"218",TRUE,"2026-01-30 00:42:09","Yes","Preparations (IRB permit, preregistration, experiment preparations)","","","6","5","6","5","5","5","5","5","3","5","0","0","0","0","0","0","0","0","0","0","","2","Doing something meaningful and achievement. Respect from others","Lab/online research","Assistant professor","Health sciences","Woman","35","Canada",""
740,"392",TRUE,"2026-01-30 02:12:21","Yes","Waiting for journal's response and revisions","","","7","4","6","5","5","5","2","4","7","4","0","1","1","0","1","0","0","0","0","0","We did excellent science, made interesting discoveries, and improved our understanding.","2","There is nothing quite like making a discovery and knowing that, until you tell the story, you are the only person on the planet who knows it.","Field research","Full professor","Life sciences","Man","73","Australia",""
741,"35056",TRUE,"2026-01-30 02:32:09","Yes","Data analysis","","","6","5","4","4","4","5","1","1","2","5","1","3","1","1","1","1","1","1","1","1","The analyses were demanding but provide interesting findings","2","Freedom of time","Lab/online research","Associate professor","Social sciences","Man","35","Japan",""
742,"571",TRUE,"2026-01-30 03:35:56","Yes","Post-project stage (the project has received a decision (accepted or rejected). At this point, it is either concluded or being revised and prepared for submission to another venue)","Accepted and published","","6","4","4","3","3","4","4","5","1","3","5","4","5","0","5","0","4","5","0","4","After accepting the manuscript, the journal took so long to move through the administrative processes that we lost our open access finding and had to publish in the pay-per-view model (behind the paywall).","2","Feeling of adding value and making a positive contribution to the world that may help people improve the quality of their lives.","Clinical research","Postdoc","Health sciences","Woman","51","Australia",""
743,"413",TRUE,"2026-01-30 03:45:49","Yes","Data collection","","","7","0","6","0","6","4","0","3","0","4","1","0","1","0","1","0","0","0","0","0","'Interest'. I am a policy researcher. We need to develop atypical systems here in India, that are helpful to patients. I am understanding what has been done in other countries, with regard to these atypical systems, to make policy recommendations for our country.","3","I have been a relatively unique kind of researcher. A scientist turned policy researcher. We don't have many of them. And I took up topics that the government didn't wish me to, but that served the public interest.","Lab/online research","Other","Health sciences","Woman","63","India",""
744,"163",TRUE,"2026-01-30 04:23:07","Yes","Data analysis","","","4","4","4","4","4","4","4","4","4","4","1","1","1","1","1","1","4","1","1","2","","1","","Clinical research","Other","Health sciences","Woman","","China",""
745,"970",TRUE,"2026-01-30 05:03:25","Yes","Waiting for journal's response and revisions","","","7","6","7","2","1","7","1","4","6","6","5","5","5","5","7","5","5","5","6","6","Paper got rejected saying no novelty in the work","0","Academic pressure as well as familypressure","Lab/online research","Assistant professor","Physical sciences","Prefer not to say","","India",""
746,"390",TRUE,"2026-01-30 06:49:19","Yes","Data analysis","","","5","3","6","6","6","4","4","6","2","6","2","7","5","2","2","4","0","1","0","1","Guilt is the most intense feeling, as I feel not able to spend enough time on this important interdisciplinary project","2","It is one of the best jobs in the world. I continue to learn something new everyday. ","Field research","Full professor","Social sciences","Man","64","United Kingdom of Great Britain and Northern Ireland",""
747,"1126",TRUE,"2026-01-30 07:04:05","Yes","Data analysis","","","5","3","3","1","2","3","4","4","2","3","2","0","1","0","0","0","0","0","0","1","compressed Need to finish the work in good way and have good paper at the end to feel contentment","0","I do all my best ","Field research","Full professor","Life sciences","Woman","47","Egypt",""
748,"576",TRUE,"2026-01-30 07:34:16","Yes","Preparations (IRB permit, preregistration, experiment preparations)","","","5","4","5","3","3","3","2","2","2","5","1","2","2","2","2","3","0","3","0","0","I’m proud to be funded and able to do research, that someone believes in the work that I have done","0","It can be tough to balance working with research outside of my primary work hours and prioritizing time spend with my family","Clinical research","Postdoc","Health sciences","Woman","37","Denmark",""
